symptoms,prescription
"back pain, body ache, shortness of breath","doxycycline 100mg bid, oral rehydration salts, hydrocortisone cream bid, ecg test"
"dizziness, abdominal pain, eye redness, palpitations","amoxicillin 500mg tid, pantoprazole 40mg od, hydrocortisone cream bid, urine analysis, ecg test"
"itching, joint pain, difficulty breathing, shortness of breath","atorvastatin 10mg od, levocetirizine 5mg od, iron supplements od, urine analysis, spirometry"
"chest pain, muscle pain, dizziness","cetirizine 10mg od, pantoprazole 40mg od, azithromycin 500mg od, stool test, malaria parasite test"
"loss of appetite, body ache, joint pain, night sweats","iron supplements od, paracetamol 500mg tid, hydrocortisone cream bid, spirometry, stool test"
"frequent urination, loss of appetite, body ache","paracetamol 500mg tid, hydrocortisone cream bid, throat swab culture"
"diarrhea, chest pain","multivitamin daily, diclofenac 50mg bid, doxycycline 100mg bid, x-ray chest, spirometry"
"diarrhea, joint pain","loratadine 10mg od, metronidazole 400mg tid, kidney function test"
"diarrhea, frequent urination","hydrocortisone cream bid, ibuprofen 400mg bid, throat swab culture"
"headache, diarrhea","doxycycline 100mg bid, oral rehydration salts, loratadine 10mg od, cbc blood test, malaria parasite test"
"skin rash, shortness of breath, loss of taste","iron supplements od, levocetirizine 5mg od, amoxicillin 500mg tid, ecg test, urine analysis"
"weight loss, sore throat, headache, sneezing","cetirizine 10mg od, paracetamol 500mg tid, urine analysis, ecg test"
"sore throat, dizziness, loss of smell, cough","atorvastatin 10mg od, azithromycin 500mg od, multivitamin daily, serum electrolytes, blood sugar test"
"swelling, diarrhea, skin rash","atorvastatin 10mg od, loratadine 10mg od, cbc blood test, stool test"
"runny nose, muscle pain, difficulty breathing, itching","hydrocortisone cream bid, iron supplements od, metronidazole 400mg tid, blood sugar test"
"cough, loss of taste, shortness of breath, sneezing","ibuprofen 400mg bid, iron supplements od, stool test"
"fatigue, loss of smell, runny nose, night sweats","pantoprazole 40mg od, azithromycin 500mg od, liver function test"
"frequent urination, loss of taste, fatigue","diclofenac 50mg bid, multivitamin daily, dengue test, serum electrolytes"
"fever, headache, loss of appetite","salbutamol inhaler prn, diclofenac 50mg bid, azithromycin 500mg od, ecg test, liver function test"
"itching, dizziness, fatigue","amoxicillin 500mg tid, oral rehydration salts, pantoprazole 40mg od, liver function test"
"swelling, sneezing","doxycycline 100mg bid, paracetamol 500mg tid, amoxicillin 500mg tid, spirometry"
"burning urination, vomiting, dizziness, ear pain","diclofenac 50mg bid, oral rehydration salts, ibuprofen 400mg bid, ecg test, spirometry"
"productive cough, sore throat","paracetamol 500mg tid, pantoprazole 40mg od, blood sugar test, spirometry"
"ear pain, dizziness, palpitations, headache","metronidazole 400mg tid, amoxicillin 500mg tid, multivitamin daily, urine analysis"
"runny nose, itching, body ache, headache","azithromycin 500mg od, atorvastatin 10mg od, hydrocortisone cream bid, serum electrolytes, malaria parasite test"
"joint pain, loss of smell, fever","atorvastatin 10mg od, azithromycin 500mg od, malaria parasite test, serum electrolytes"
"diarrhea, swelling, eye redness","atorvastatin 10mg od, iron supplements od, metronidazole 400mg tid, blood sugar test"
"frequent urination, joint pain","oral rehydration salts, atorvastatin 10mg od, azithromycin 500mg od, dengue test"
"weight loss, back pain, night sweats","paracetamol 500mg tid, hydrocortisone cream bid, multivitamin daily, cbc blood test, ecg test"
"fever, shortness of breath, abdominal pain","cetirizine 10mg od, metronidazole 400mg tid, doxycycline 100mg bid, throat swab culture"
"skin rash, sneezing, frequent urination, runny nose","iron supplements od, metronidazole 400mg tid, cetirizine 10mg od, dengue test, liver function test"
"abdominal pain, eye redness, loss of taste, palpitations","paracetamol 500mg tid, loratadine 10mg od, throat swab culture"
"loss of taste, joint pain, cough","diclofenac 50mg bid, loratadine 10mg od, cetirizine 10mg od, ecg test"
"back pain, frequent urination, shortness of breath","hydrocortisone cream bid, pantoprazole 40mg od, throat swab culture"
"itching, night sweats, sore throat, vomiting","amoxicillin 500mg tid, azithromycin 500mg od, ondansetron 4mg tid, blood sugar test, dengue test"
"runny nose, loss of smell, eye redness, swelling","iron supplements od, levocetirizine 5mg od, cetirizine 10mg od, x-ray chest"
"sneezing, muscle pain","salbutamol inhaler prn, pantoprazole 40mg od, iron supplements od, ecg test"
"muscle pain, runny nose","ondansetron 4mg tid, levocetirizine 5mg od, hydrocortisone cream bid, spirometry"
"shortness of breath, dizziness","atorvastatin 10mg od, levocetirizine 5mg od, dengue test, throat swab culture"
"runny nose, fever, productive cough, weight loss","iron supplements od, ibuprofen 400mg bid, cbc blood test"
"chest pain, burning urination, weight loss","azithromycin 500mg od, cetirizine 10mg od, cbc blood test"
"shortness of breath, difficulty breathing, dizziness, body ache","atorvastatin 10mg od, loratadine 10mg od, urine analysis"
"vomiting, headache, loss of appetite, swelling","doxycycline 100mg bid, loratadine 10mg od, salbutamol inhaler prn, ecg test, stool test"
"itching, abdominal pain","doxycycline 100mg bid, azithromycin 500mg od, stool test, x-ray chest"
"cough, night sweats, loss of appetite","levocetirizine 5mg od, amoxicillin 500mg tid, blood sugar test, malaria parasite test"
"body ache, fever, dizziness, joint pain","metronidazole 400mg tid, hydrocortisone cream bid, oral rehydration salts, malaria parasite test"
"sore throat, joint pain, shortness of breath, back pain","paracetamol 500mg tid, amoxicillin 500mg tid, dengue test, kidney function test"
"frequent urination, shortness of breath, headache","amoxicillin 500mg tid, paracetamol 500mg tid, liver function test"
"vomiting, ear pain","hydrocortisone cream bid, iron supplements od, serum electrolytes"
"shortness of breath, chest pain, frequent urination","oral rehydration salts, iron supplements od, levocetirizine 5mg od, kidney function test, stool test"
"productive cough, sore throat","salbutamol inhaler prn, ondansetron 4mg tid, paracetamol 500mg tid, stool test, urine analysis"
"swelling, headache, fatigue, dizziness","levocetirizine 5mg od, doxycycline 100mg bid, x-ray chest, ecg test"
"loss of smell, runny nose, skin rash, back pain","diclofenac 50mg bid, amoxicillin 500mg tid, blood sugar test"
"palpitations, abdominal pain, ear pain, fever","atorvastatin 10mg od, ibuprofen 400mg bid, spirometry, serum electrolytes"
"chest pain, palpitations, muscle pain","metronidazole 400mg tid, iron supplements od, cbc blood test"
"dizziness, shortness of breath","amoxicillin 500mg tid, levocetirizine 5mg od, diclofenac 50mg bid, serum electrolytes"
"abdominal pain, weight loss, cough, ear pain","diclofenac 50mg bid, loratadine 10mg od, cbc blood test"
"abdominal pain, loss of appetite","cetirizine 10mg od, diclofenac 50mg bid, throat swab culture"
"difficulty breathing, skin rash, sneezing, night sweats","oral rehydration salts, ondansetron 4mg tid, x-ray chest, spirometry"
"night sweats, abdominal pain, back pain, eye redness","ondansetron 4mg tid, amoxicillin 500mg tid, dengue test"
"productive cough, fatigue, abdominal pain, night sweats","ibuprofen 400mg bid, ondansetron 4mg tid, salbutamol inhaler prn, kidney function test"
"itching, abdominal pain","cetirizine 10mg od, pantoprazole 40mg od, cbc blood test, serum electrolytes"
"ear pain, swelling","iron supplements od, cetirizine 10mg od, blood sugar test, cbc blood test"
"swelling, dizziness, skin rash, chest pain","iron supplements od, paracetamol 500mg tid, oral rehydration salts, ecg test, cbc blood test"
"fatigue, productive cough, headache, skin rash","doxycycline 100mg bid, paracetamol 500mg tid, oral rehydration salts, spirometry, malaria parasite test"
"frequent urination, vomiting, productive cough","ibuprofen 400mg bid, salbutamol inhaler prn, iron supplements od, stool test"
"back pain, loss of appetite","loratadine 10mg od, ondansetron 4mg tid, pantoprazole 40mg od, throat swab culture"
"runny nose, headache, muscle pain","doxycycline 100mg bid, salbutamol inhaler prn, stool test, kidney function test"
"loss of appetite, dizziness, loss of smell","atorvastatin 10mg od, ibuprofen 400mg bid, malaria parasite test, throat swab culture"
"abdominal pain, vomiting, loss of taste","salbutamol inhaler prn, oral rehydration salts, ecg test"
"ear pain, dizziness, headache","azithromycin 500mg od, oral rehydration salts, serum electrolytes"
"loss of taste, eye redness","ondansetron 4mg tid, ibuprofen 400mg bid, spirometry"
"back pain, abdominal pain","ibuprofen 400mg bid, cetirizine 10mg od, kidney function test"
"body ache, dizziness, vomiting","ibuprofen 400mg bid, levocetirizine 5mg od, ecg test"
"vomiting, fever, sore throat","cetirizine 10mg od, iron supplements od, blood sugar test"
"shortness of breath, night sweats","doxycycline 100mg bid, atorvastatin 10mg od, diclofenac 50mg bid, malaria parasite test"
"vomiting, fever, fatigue, joint pain","metronidazole 400mg tid, iron supplements od, azithromycin 500mg od, cbc blood test"
"palpitations, vomiting, sore throat","diclofenac 50mg bid, pantoprazole 40mg od, kidney function test, malaria parasite test"
"productive cough, difficulty breathing","metronidazole 400mg tid, atorvastatin 10mg od, cetirizine 10mg od, x-ray chest, stool test"
"loss of smell, cough","hydrocortisone cream bid, atorvastatin 10mg od, amoxicillin 500mg tid, cbc blood test"
"runny nose, frequent urination","loratadine 10mg od, azithromycin 500mg od, pantoprazole 40mg od, stool test, throat swab culture"
"body ache, headache, dizziness","iron supplements od, oral rehydration salts, ecg test, stool test"
"chest pain, dizziness, joint pain","azithromycin 500mg od, doxycycline 100mg bid, kidney function test"
"eye redness, loss of taste","hydrocortisone cream bid, azithromycin 500mg od, multivitamin daily, serum electrolytes"
"weight loss, diarrhea, joint pain","doxycycline 100mg bid, levocetirizine 5mg od, diclofenac 50mg bid, x-ray chest, throat swab culture"
"loss of taste, joint pain, swelling","paracetamol 500mg tid, metronidazole 400mg tid, malaria parasite test, cbc blood test"
"shortness of breath, productive cough, runny nose","azithromycin 500mg od, doxycycline 100mg bid, levocetirizine 5mg od, stool test"
"joint pain, loss of appetite","doxycycline 100mg bid, oral rehydration salts, ibuprofen 400mg bid, x-ray chest, dengue test"
"skin rash, loss of smell, fatigue","azithromycin 500mg od, amoxicillin 500mg tid, throat swab culture"
"abdominal pain, palpitations, diarrhea, headache","ibuprofen 400mg bid, oral rehydration salts, multivitamin daily, stool test"
"loss of smell, diarrhea","loratadine 10mg od, atorvastatin 10mg od, salbutamol inhaler prn, ecg test"
"back pain, ear pain","oral rehydration salts, pantoprazole 40mg od, ondansetron 4mg tid, throat swab culture"
"muscle pain, runny nose","ondansetron 4mg tid, paracetamol 500mg tid, dengue test"
"eye redness, palpitations, back pain, difficulty breathing","iron supplements od, amoxicillin 500mg tid, dengue test"
"muscle pain, fatigue, runny nose","atorvastatin 10mg od, azithromycin 500mg od, cbc blood test, ecg test"
"dizziness, back pain","paracetamol 500mg tid, iron supplements od, cbc blood test, urine analysis"
"burning urination, body ache, frequent urination, runny nose","metronidazole 400mg tid, multivitamin daily, ecg test, cbc blood test"
"loss of appetite, skin rash, palpitations, shortness of breath","ibuprofen 400mg bid, doxycycline 100mg bid, cetirizine 10mg od, x-ray chest"
"fever, productive cough, body ache","oral rehydration salts, azithromycin 500mg od, serum electrolytes, stool test"
"ear pain, dizziness, vomiting","salbutamol inhaler prn, iron supplements od, ecg test"
"sore throat, sneezing","amoxicillin 500mg tid, loratadine 10mg od, kidney function test"
"night sweats, ear pain, joint pain","multivitamin daily, ondansetron 4mg tid, pantoprazole 40mg od, blood sugar test"
"shortness of breath, loss of smell","cetirizine 10mg od, levocetirizine 5mg od, hydrocortisone cream bid, dengue test, serum electrolytes"
"frequent urination, vomiting, productive cough","pantoprazole 40mg od, metronidazole 400mg tid, oral rehydration salts, liver function test, stool test"
"palpitations, headache, cough","levocetirizine 5mg od, metronidazole 400mg tid, cbc blood test"
"swelling, abdominal pain","loratadine 10mg od, azithromycin 500mg od, amoxicillin 500mg tid, spirometry"
"fatigue, muscle pain, back pain","oral rehydration salts, iron supplements od, salbutamol inhaler prn, liver function test"
"chest pain, sneezing, joint pain","pantoprazole 40mg od, metronidazole 400mg tid, loratadine 10mg od, ecg test"
"shortness of breath, vomiting","paracetamol 500mg tid, multivitamin daily, blood sugar test"
"ear pain, body ache, eye redness","azithromycin 500mg od, loratadine 10mg od, diclofenac 50mg bid, kidney function test, serum electrolytes"
"burning urination, vomiting, back pain, dizziness","hydrocortisone cream bid, iron supplements od, cetirizine 10mg od, urine analysis"
"sore throat, productive cough, muscle pain, itching","cetirizine 10mg od, diclofenac 50mg bid, paracetamol 500mg tid, ecg test, cbc blood test"
"runny nose, sneezing, loss of appetite, headache","oral rehydration salts, doxycycline 100mg bid, stool test, ecg test"
"shortness of breath, difficulty breathing, loss of smell","pantoprazole 40mg od, iron supplements od, amoxicillin 500mg tid, blood sugar test"
"swelling, headache, muscle pain","ibuprofen 400mg bid, iron supplements od, atorvastatin 10mg od, serum electrolytes, x-ray chest"
"cough, weight loss","doxycycline 100mg bid, amoxicillin 500mg tid, spirometry"
"vomiting, burning urination, loss of taste, swelling","hydrocortisone cream bid, oral rehydration salts, metronidazole 400mg tid, kidney function test, malaria parasite test"
"sore throat, weight loss, joint pain","cetirizine 10mg od, doxycycline 100mg bid, urine analysis"
"joint pain, loss of appetite","multivitamin daily, iron supplements od, doxycycline 100mg bid, blood sugar test"
"night sweats, abdominal pain, sore throat","paracetamol 500mg tid, salbutamol inhaler prn, liver function test, x-ray chest"
"loss of smell, shortness of breath, loss of appetite, sore throat","atorvastatin 10mg od, ondansetron 4mg tid, throat swab culture"
"itching, sore throat","ibuprofen 400mg bid, loratadine 10mg od, stool test, blood sugar test"
"loss of taste, sore throat","diclofenac 50mg bid, doxycycline 100mg bid, salbutamol inhaler prn, ecg test, liver function test"
"back pain, joint pain, swelling","diclofenac 50mg bid, amoxicillin 500mg tid, blood sugar test, malaria parasite test"
"shortness of breath, palpitations, joint pain, abdominal pain","ibuprofen 400mg bid, levocetirizine 5mg od, salbutamol inhaler prn, ecg test"
"abdominal pain, sore throat, eye redness, weight loss","doxycycline 100mg bid, pantoprazole 40mg od, serum electrolytes"
"skin rash, eye redness, headache, swelling","diclofenac 50mg bid, loratadine 10mg od, oral rehydration salts, serum electrolytes, malaria parasite test"
"skin rash, runny nose, weight loss","cetirizine 10mg od, multivitamin daily, hydrocortisone cream bid, throat swab culture"
"abdominal pain, night sweats","salbutamol inhaler prn, levocetirizine 5mg od, atorvastatin 10mg od, ecg test"
"abdominal pain, palpitations, shortness of breath","doxycycline 100mg bid, loratadine 10mg od, serum electrolytes"
"loss of smell, cough, back pain, body ache","metronidazole 400mg tid, paracetamol 500mg tid, oral rehydration salts, dengue test"
"loss of taste, dizziness","oral rehydration salts, salbutamol inhaler prn, blood sugar test"
"back pain, itching, dizziness, ear pain","iron supplements od, cetirizine 10mg od, blood sugar test"
"swelling, productive cough, fever","ibuprofen 400mg bid, oral rehydration salts, salbutamol inhaler prn, urine analysis, liver function test"
"ear pain, loss of taste","salbutamol inhaler prn, ibuprofen 400mg bid, kidney function test"
"palpitations, sneezing","loratadine 10mg od, amoxicillin 500mg tid, malaria parasite test, spirometry"
"runny nose, muscle pain, loss of appetite, shortness of breath","ibuprofen 400mg bid, loratadine 10mg od, stool test"
"ear pain, fever, diarrhea","azithromycin 500mg od, pantoprazole 40mg od, iron supplements od, blood sugar test, spirometry"
"itching, ear pain, difficulty breathing, headache","levocetirizine 5mg od, hydrocortisone cream bid, ecg test"
"night sweats, fatigue, back pain, palpitations","paracetamol 500mg tid, levocetirizine 5mg od, dengue test"
"chest pain, body ache, loss of smell, sneezing","salbutamol inhaler prn, hydrocortisone cream bid, cetirizine 10mg od, stool test"
"sneezing, weight loss, back pain","oral rehydration salts, cetirizine 10mg od, amoxicillin 500mg tid, throat swab culture, urine analysis"
"dizziness, difficulty breathing, palpitations","doxycycline 100mg bid, multivitamin daily, malaria parasite test"
"frequent urination, chest pain","hydrocortisone cream bid, metronidazole 400mg tid, ibuprofen 400mg bid, x-ray chest"
"palpitations, sneezing","diclofenac 50mg bid, loratadine 10mg od, levocetirizine 5mg od, dengue test, serum electrolytes"
"swelling, loss of smell","azithromycin 500mg od, hydrocortisone cream bid, iron supplements od, blood sugar test, malaria parasite test"
"muscle pain, fatigue","multivitamin daily, azithromycin 500mg od, atorvastatin 10mg od, x-ray chest"
"itching, back pain, shortness of breath, vomiting","paracetamol 500mg tid, multivitamin daily, metronidazole 400mg tid, liver function test"
"muscle pain, runny nose, palpitations, back pain","azithromycin 500mg od, salbutamol inhaler prn, throat swab culture"
"joint pain, ear pain, palpitations, runny nose","pantoprazole 40mg od, ondansetron 4mg tid, x-ray chest, stool test"
"body ache, sneezing, loss of appetite","amoxicillin 500mg tid, loratadine 10mg od, levocetirizine 5mg od, x-ray chest, dengue test"
"palpitations, muscle pain, dizziness","hydrocortisone cream bid, multivitamin daily, oral rehydration salts, liver function test, malaria parasite test"
"muscle pain, sore throat","iron supplements od, metronidazole 400mg tid, x-ray chest"
"fever, runny nose, ear pain, swelling","hydrocortisone cream bid, pantoprazole 40mg od, malaria parasite test, spirometry"
"ear pain, back pain, fatigue, diarrhea","paracetamol 500mg tid, pantoprazole 40mg od, urine analysis"
"loss of taste, chest pain, ear pain, dizziness","paracetamol 500mg tid, multivitamin daily, cbc blood test"
"runny nose, burning urination","ondansetron 4mg tid, metronidazole 400mg tid, blood sugar test, x-ray chest"
"diarrhea, burning urination","atorvastatin 10mg od, azithromycin 500mg od, ecg test, liver function test"
"swelling, productive cough","pantoprazole 40mg od, azithromycin 500mg od, oral rehydration salts, throat swab culture, dengue test"
"sore throat, joint pain","cetirizine 10mg od, doxycycline 100mg bid, azithromycin 500mg od, kidney function test"
"itching, headache, sore throat","multivitamin daily, ibuprofen 400mg bid, azithromycin 500mg od, kidney function test"
"chest pain, loss of smell","levocetirizine 5mg od, paracetamol 500mg tid, atorvastatin 10mg od, kidney function test, x-ray chest"
"vomiting, swelling, skin rash, joint pain","azithromycin 500mg od, cetirizine 10mg od, diclofenac 50mg bid, malaria parasite test"
"dizziness, productive cough","azithromycin 500mg od, multivitamin daily, ondansetron 4mg tid, spirometry"
"loss of smell, body ache","azithromycin 500mg od, paracetamol 500mg tid, ecg test, malaria parasite test"
"vomiting, abdominal pain","ibuprofen 400mg bid, ondansetron 4mg tid, kidney function test, ecg test"
"shortness of breath, weight loss, productive cough, runny nose","salbutamol inhaler prn, paracetamol 500mg tid, serum electrolytes"
"chest pain, dizziness","amoxicillin 500mg tid, iron supplements od, ibuprofen 400mg bid, serum electrolytes, blood sugar test"
"headache, burning urination","salbutamol inhaler prn, paracetamol 500mg tid, throat swab culture, dengue test"
"sore throat, fever, loss of smell, cough","ondansetron 4mg tid, pantoprazole 40mg od, levocetirizine 5mg od, liver function test, stool test"
"back pain, burning urination, loss of taste","paracetamol 500mg tid, cetirizine 10mg od, pantoprazole 40mg od, liver function test, malaria parasite test"
"vomiting, runny nose","azithromycin 500mg od, paracetamol 500mg tid, hydrocortisone cream bid, serum electrolytes"
"muscle pain, night sweats, sore throat, abdominal pain","multivitamin daily, pantoprazole 40mg od, metronidazole 400mg tid, spirometry, cbc blood test"
"difficulty breathing, loss of taste, cough","paracetamol 500mg tid, ondansetron 4mg tid, blood sugar test"
"loss of smell, chest pain, dizziness, runny nose","ondansetron 4mg tid, hydrocortisone cream bid, ibuprofen 400mg bid, malaria parasite test"
"abdominal pain, runny nose, chest pain","loratadine 10mg od, oral rehydration salts, throat swab culture, liver function test"
"joint pain, cough, headache","doxycycline 100mg bid, cetirizine 10mg od, ecg test"
"diarrhea, body ache, palpitations","ondansetron 4mg tid, atorvastatin 10mg od, blood sugar test"
"weight loss, loss of smell, abdominal pain","diclofenac 50mg bid, iron supplements od, ibuprofen 400mg bid, x-ray chest, malaria parasite test"
"productive cough, difficulty breathing, loss of taste","salbutamol inhaler prn, ondansetron 4mg tid, amoxicillin 500mg tid, stool test"
"productive cough, loss of taste, sore throat","paracetamol 500mg tid, levocetirizine 5mg od, cetirizine 10mg od, cbc blood test, throat swab culture"
"body ache, skin rash, dizziness","cetirizine 10mg od, diclofenac 50mg bid, doxycycline 100mg bid, urine analysis, x-ray chest"
"burning urination, muscle pain, skin rash","cetirizine 10mg od, oral rehydration salts, liver function test"
"loss of appetite, skin rash, dizziness, night sweats","atorvastatin 10mg od, ibuprofen 400mg bid, iron supplements od, ecg test"
"frequent urination, productive cough, loss of smell","levocetirizine 5mg od, amoxicillin 500mg tid, doxycycline 100mg bid, blood sugar test"
"loss of smell, runny nose, muscle pain","atorvastatin 10mg od, cetirizine 10mg od, spirometry"
"sneezing, dizziness","loratadine 10mg od, iron supplements od, throat swab culture, liver function test"
"night sweats, cough, back pain, sore throat","paracetamol 500mg tid, ibuprofen 400mg bid, doxycycline 100mg bid, malaria parasite test"
"loss of smell, diarrhea","amoxicillin 500mg tid, salbutamol inhaler prn, metronidazole 400mg tid, malaria parasite test, blood sugar test"
"abdominal pain, sneezing, palpitations","pantoprazole 40mg od, cetirizine 10mg od, hydrocortisone cream bid, stool test, cbc blood test"
"headache, diarrhea","levocetirizine 5mg od, multivitamin daily, spirometry, malaria parasite test"
"fatigue, fever, loss of appetite, headache","ondansetron 4mg tid, salbutamol inhaler prn, kidney function test, ecg test"
"fatigue, sneezing, loss of appetite, swelling","hydrocortisone cream bid, metronidazole 400mg tid, spirometry"
"sneezing, headache","salbutamol inhaler prn, ondansetron 4mg tid, amoxicillin 500mg tid, throat swab culture, dengue test"
"vomiting, fatigue, headache, diarrhea","azithromycin 500mg od, pantoprazole 40mg od, stool test"
"body ache, eye redness","cetirizine 10mg od, loratadine 10mg od, levocetirizine 5mg od, urine analysis"
"eye redness, loss of smell, joint pain, abdominal pain","salbutamol inhaler prn, loratadine 10mg od, throat swab culture"
"skin rash, burning urination, ear pain, headache","diclofenac 50mg bid, azithromycin 500mg od, ondansetron 4mg tid, stool test"
"loss of smell, joint pain","amoxicillin 500mg tid, oral rehydration salts, loratadine 10mg od, kidney function test"
"loss of smell, night sweats, ear pain, skin rash","ibuprofen 400mg bid, iron supplements od, x-ray chest"
"muscle pain, difficulty breathing, loss of smell, fever","doxycycline 100mg bid, salbutamol inhaler prn, ibuprofen 400mg bid, blood sugar test, spirometry"
"loss of smell, headache, night sweats","doxycycline 100mg bid, salbutamol inhaler prn, paracetamol 500mg tid, throat swab culture, stool test"
"diarrhea, weight loss, palpitations","oral rehydration salts, diclofenac 50mg bid, ecg test"
"joint pain, sneezing, burning urination","oral rehydration salts, metronidazole 400mg tid, stool test, malaria parasite test"
"chest pain, loss of smell, cough","paracetamol 500mg tid, doxycycline 100mg bid, metronidazole 400mg tid, x-ray chest, malaria parasite test"
"palpitations, weight loss, sore throat, skin rash","amoxicillin 500mg tid, ondansetron 4mg tid, multivitamin daily, malaria parasite test, stool test"
"body ache, night sweats","oral rehydration salts, cetirizine 10mg od, amoxicillin 500mg tid, ecg test, spirometry"
"itching, sneezing, fatigue, ear pain","paracetamol 500mg tid, hydrocortisone cream bid, ecg test"
"muscle pain, sneezing, abdominal pain","pantoprazole 40mg od, azithromycin 500mg od, diclofenac 50mg bid, throat swab culture, spirometry"
"burning urination, dizziness","azithromycin 500mg od, metronidazole 400mg tid, urine analysis"
"fatigue, loss of taste","ibuprofen 400mg bid, atorvastatin 10mg od, salbutamol inhaler prn, malaria parasite test"
"abdominal pain, weight loss, palpitations, frequent urination","paracetamol 500mg tid, amoxicillin 500mg tid, diclofenac 50mg bid, dengue test, liver function test"
"ear pain, vomiting","metronidazole 400mg tid, iron supplements od, atorvastatin 10mg od, x-ray chest, spirometry"
