symptoms,prescription
"swelling, itching, chest pain","salbutamol inhaler prn, cetirizine 10mg od, oral rehydration salts, stool test"
"burning urination, palpitations, dizziness","levocetirizine 5mg od, doxycycline 100mg bid, pantoprazole 40mg od, dengue test"
"burning urination, fatigue, difficulty breathing","ibuprofen 400mg bid, diclofenac 50mg bid, ecg test, cbc blood test"
"fatigue, chest pain","loratadine 10mg od, hydrocortisone cream bid, malaria parasite test, liver function test"
"vomiting, skin rash","atorvastatin 10mg od, oral rehydration salts, stool test"
"skin rash, vomiting, loss of appetite","diclofenac 50mg bid, iron supplements od, paracetamol 500mg tid, ecg test"
"fatigue, loss of appetite, productive cough","iron supplements od, salbutamol inhaler prn, urine analysis"
"sore throat, vomiting, weight loss, swelling","atorvastatin 10mg od, ondansetron 4mg tid, paracetamol 500mg tid, spirometry"
"difficulty breathing, loss of taste","hydrocortisone cream bid, levocetirizine 5mg od, paracetamol 500mg tid, kidney function test"
"skin rash, vomiting, diarrhea, weight loss","cetirizine 10mg od, amoxicillin 500mg tid, iron supplements od, stool test"
"cough, loss of taste, frequent urination, skin rash","oral rehydration salts, azithromycin 500mg od, amoxicillin 500mg tid, serum electrolytes, spirometry"
"shortness of breath, difficulty breathing","loratadine 10mg od, amoxicillin 500mg tid, atorvastatin 10mg od, spirometry, malaria parasite test"
"headache, sore throat, loss of smell","diclofenac 50mg bid, hydrocortisone cream bid, serum electrolytes"
"joint pain, eye redness","amoxicillin 500mg tid, salbutamol inhaler prn, ondansetron 4mg tid, kidney function test"
"loss of taste, abdominal pain, palpitations","salbutamol inhaler prn, paracetamol 500mg tid, spirometry"
"abdominal pain, loss of taste","atorvastatin 10mg od, salbutamol inhaler prn, urine analysis"
"muscle pain, runny nose","paracetamol 500mg tid, hydrocortisone cream bid, spirometry, x-ray chest"
"body ache, dizziness, loss of taste","amoxicillin 500mg tid, multivitamin daily, pantoprazole 40mg od, serum electrolytes, dengue test"
"loss of smell, skin rash, burning urination","doxycycline 100mg bid, diclofenac 50mg bid, blood sugar test, x-ray chest"
"sore throat, loss of appetite, frequent urination","salbutamol inhaler prn, doxycycline 100mg bid, cetirizine 10mg od, malaria parasite test"
"diarrhea, frequent urination, burning urination","pantoprazole 40mg od, cetirizine 10mg od, blood sugar test"
"chest pain, diarrhea, ear pain, loss of appetite","diclofenac 50mg bid, paracetamol 500mg tid, salbutamol inhaler prn, spirometry"
"frequent urination, shortness of breath, swelling","hydrocortisone cream bid, azithromycin 500mg od, amoxicillin 500mg tid, dengue test, throat swab culture"
"weight loss, loss of smell, swelling, night sweats","loratadine 10mg od, iron supplements od, ecg test, dengue test"
"diarrhea, palpitations","cetirizine 10mg od, ondansetron 4mg tid, stool test, dengue test"
"weight loss, night sweats","cetirizine 10mg od, multivitamin daily, pantoprazole 40mg od, spirometry"
"dizziness, itching, diarrhea, back pain","oral rehydration salts, doxycycline 100mg bid, atorvastatin 10mg od, blood sugar test"
"fatigue, body ache","salbutamol inhaler prn, cetirizine 10mg od, throat swab culture, blood sugar test"
"loss of appetite, body ache, loss of smell","cetirizine 10mg od, metronidazole 400mg tid, iron supplements od, kidney function test"
"abdominal pain, runny nose","paracetamol 500mg tid, hydrocortisone cream bid, ibuprofen 400mg bid, cbc blood test, spirometry"
"joint pain, fatigue, productive cough, cough","loratadine 10mg od, iron supplements od, throat swab culture"
"muscle pain, loss of taste, frequent urination, eye redness","oral rehydration salts, atorvastatin 10mg od, salbutamol inhaler prn, dengue test, serum electrolytes"
"body ache, difficulty breathing","hydrocortisone cream bid, amoxicillin 500mg tid, ecg test"
"swelling, dizziness, frequent urination, fever","paracetamol 500mg tid, doxycycline 100mg bid, ibuprofen 400mg bid, kidney function test, cbc blood test"
"runny nose, loss of smell, chest pain, sore throat","azithromycin 500mg od, salbutamol inhaler prn, serum electrolytes, stool test"
"eye redness, runny nose","atorvastatin 10mg od, ondansetron 4mg tid, x-ray chest"
"night sweats, loss of smell, skin rash, burning urination","atorvastatin 10mg od, pantoprazole 40mg od, oral rehydration salts, x-ray chest, spirometry"
"productive cough, sore throat, cough","atorvastatin 10mg od, oral rehydration salts, throat swab culture, dengue test"
"palpitations, back pain, joint pain, itching","levocetirizine 5mg od, diclofenac 50mg bid, urine analysis"
"cough, skin rash, eye redness, joint pain","loratadine 10mg od, metronidazole 400mg tid, multivitamin daily, malaria parasite test"
"dizziness, diarrhea, sore throat, muscle pain","multivitamin daily, salbutamol inhaler prn, kidney function test, throat swab culture"
"difficulty breathing, fatigue, shortness of breath","metronidazole 400mg tid, levocetirizine 5mg od, liver function test, dengue test"
"skin rash, loss of smell, fatigue, frequent urination","atorvastatin 10mg od, ibuprofen 400mg bid, pantoprazole 40mg od, blood sugar test, kidney function test"
"fever, vomiting, loss of taste, palpitations","loratadine 10mg od, salbutamol inhaler prn, cbc blood test, ecg test"
"fatigue, muscle pain, skin rash","iron supplements od, loratadine 10mg od, malaria parasite test"
"headache, weight loss, dizziness, sore throat","diclofenac 50mg bid, amoxicillin 500mg tid, paracetamol 500mg tid, blood sugar test"
"fever, ear pain, night sweats, loss of appetite","cetirizine 10mg od, iron supplements od, malaria parasite test"
"loss of taste, difficulty breathing, frequent urination, cough","salbutamol inhaler prn, hydrocortisone cream bid, serum electrolytes, ecg test"
"abdominal pain, burning urination, sore throat","atorvastatin 10mg od, amoxicillin 500mg tid, hydrocortisone cream bid, stool test"
"palpitations, burning urination, sore throat","metronidazole 400mg tid, levocetirizine 5mg od, x-ray chest, urine analysis"
"loss of appetite, body ache, vomiting","amoxicillin 500mg tid, doxycycline 100mg bid, cbc blood test, spirometry"
"fever, night sweats, body ache","paracetamol 500mg tid, salbutamol inhaler prn, kidney function test, malaria parasite test"
"chest pain, palpitations, sore throat","levocetirizine 5mg od, ondansetron 4mg tid, ecg test"
"weight loss, loss of appetite","oral rehydration salts, levocetirizine 5mg od, liver function test"
"night sweats, ear pain","salbutamol inhaler prn, oral rehydration salts, kidney function test"
"loss of smell, loss of appetite, back pain","levocetirizine 5mg od, ondansetron 4mg tid, paracetamol 500mg tid, throat swab culture, ecg test"
"dizziness, ear pain, burning urination","ibuprofen 400mg bid, levocetirizine 5mg od, azithromycin 500mg od, dengue test"
"sore throat, burning urination, diarrhea","pantoprazole 40mg od, atorvastatin 10mg od, spirometry, urine analysis"
"productive cough, back pain","azithromycin 500mg od, diclofenac 50mg bid, serum electrolytes"
"body ache, swelling, night sweats, loss of smell","cetirizine 10mg od, metronidazole 400mg tid, azithromycin 500mg od, liver function test, urine analysis"
"cough, loss of smell, vomiting, runny nose","multivitamin daily, loratadine 10mg od, dengue test"
"vomiting, itching, headache","multivitamin daily, ibuprofen 400mg bid, malaria parasite test"
"itching, fever, dizziness","multivitamin daily, ibuprofen 400mg bid, x-ray chest, urine analysis"
"sneezing, sore throat","levocetirizine 5mg od, loratadine 10mg od, kidney function test, spirometry"
"chest pain, palpitations, headache","loratadine 10mg od, amoxicillin 500mg tid, urine analysis"
"ear pain, headache, vomiting","pantoprazole 40mg od, metronidazole 400mg tid, salbutamol inhaler prn, malaria parasite test"
"difficulty breathing, muscle pain, palpitations, sneezing","diclofenac 50mg bid, oral rehydration salts, malaria parasite test"
"sneezing, abdominal pain","metronidazole 400mg tid, loratadine 10mg od, malaria parasite test"
"weight loss, headache, fatigue","levocetirizine 5mg od, atorvastatin 10mg od, multivitamin daily, blood sugar test, kidney function test"
"headache, fatigue","metronidazole 400mg tid, atorvastatin 10mg od, kidney function test, spirometry"
"abdominal pain, vomiting","ondansetron 4mg tid, diclofenac 50mg bid, pantoprazole 40mg od, throat swab culture, liver function test"
"cough, itching, chest pain, back pain","ondansetron 4mg tid, ibuprofen 400mg bid, diclofenac 50mg bid, dengue test, throat swab culture"
"skin rash, headache","salbutamol inhaler prn, multivitamin daily, levocetirizine 5mg od, serum electrolytes"
"cough, vomiting","hydrocortisone cream bid, cetirizine 10mg od, stool test"
"back pain, difficulty breathing, weight loss, chest pain","paracetamol 500mg tid, hydrocortisone cream bid, levocetirizine 5mg od, serum electrolytes"
"skin rash, abdominal pain, back pain","hydrocortisone cream bid, paracetamol 500mg tid, serum electrolytes, stool test"
"weight loss, night sweats, itching","azithromycin 500mg od, levocetirizine 5mg od, doxycycline 100mg bid, blood sugar test"
"burning urination, joint pain, itching","ibuprofen 400mg bid, salbutamol inhaler prn, malaria parasite test"
"productive cough, itching, sneezing, vomiting","doxycycline 100mg bid, pantoprazole 40mg od, stool test, cbc blood test"
"runny nose, night sweats, cough, abdominal pain","multivitamin daily, paracetamol 500mg tid, levocetirizine 5mg od, cbc blood test, ecg test"
"productive cough, loss of appetite, headache, fatigue","metronidazole 400mg tid, ondansetron 4mg tid, amoxicillin 500mg tid, kidney function test, stool test"
"headache, muscle pain, burning urination","salbutamol inhaler prn, ondansetron 4mg tid, iron supplements od, spirometry"
"palpitations, muscle pain","pantoprazole 40mg od, atorvastatin 10mg od, multivitamin daily, liver function test"
"body ache, loss of taste","doxycycline 100mg bid, atorvastatin 10mg od, liver function test"
"vomiting, sneezing","pantoprazole 40mg od, multivitamin daily, serum electrolytes, stool test"
"back pain, loss of smell","cetirizine 10mg od, levocetirizine 5mg od, ecg test"
"loss of smell, fever, loss of appetite, muscle pain","metronidazole 400mg tid, ondansetron 4mg tid, stool test"
"loss of taste, eye redness, itching","ibuprofen 400mg bid, hydrocortisone cream bid, spirometry, blood sugar test"
"diarrhea, abdominal pain, dizziness, frequent urination","azithromycin 500mg od, iron supplements od, serum electrolytes"
"skin rash, ear pain, palpitations, loss of smell","pantoprazole 40mg od, amoxicillin 500mg tid, azithromycin 500mg od, liver function test"
"diarrhea, skin rash","salbutamol inhaler prn, multivitamin daily, stool test, blood sugar test"
"productive cough, muscle pain","metronidazole 400mg tid, iron supplements od, cetirizine 10mg od, malaria parasite test, urine analysis"
"swelling, headache, shortness of breath, chest pain","doxycycline 100mg bid, salbutamol inhaler prn, pantoprazole 40mg od, serum electrolytes, kidney function test"
"difficulty breathing, back pain","ibuprofen 400mg bid, oral rehydration salts, multivitamin daily, throat swab culture, ecg test"
"chest pain, itching, eye redness","ibuprofen 400mg bid, salbutamol inhaler prn, pantoprazole 40mg od, liver function test"
"dizziness, loss of taste","iron supplements od, multivitamin daily, azithromycin 500mg od, kidney function test, dengue test"
"headache, frequent urination, swelling","pantoprazole 40mg od, ibuprofen 400mg bid, salbutamol inhaler prn, serum electrolytes"
"vomiting, frequent urination","atorvastatin 10mg od, multivitamin daily, ecg test"
"weight loss, eye redness","amoxicillin 500mg tid, oral rehydration salts, serum electrolytes, x-ray chest"
"shortness of breath, diarrhea, skin rash","pantoprazole 40mg od, doxycycline 100mg bid, cbc blood test, serum electrolytes"
"frequent urination, diarrhea, productive cough","ibuprofen 400mg bid, paracetamol 500mg tid, metronidazole 400mg tid, dengue test, x-ray chest"
"palpitations, night sweats","metronidazole 400mg tid, doxycycline 100mg bid, x-ray chest, stool test"
"body ache, loss of taste, fatigue","salbutamol inhaler prn, metronidazole 400mg tid, liver function test"
"itching, vomiting, palpitations","atorvastatin 10mg od, doxycycline 100mg bid, multivitamin daily, malaria parasite test"
"burning urination, skin rash, body ache","ibuprofen 400mg bid, cetirizine 10mg od, liver function test"
"dizziness, palpitations, back pain, ear pain","ibuprofen 400mg bid, oral rehydration salts, levocetirizine 5mg od, x-ray chest, ecg test"
"diarrhea, abdominal pain, fever","azithromycin 500mg od, diclofenac 50mg bid, dengue test, stool test"
"loss of smell, loss of taste, palpitations","cetirizine 10mg od, paracetamol 500mg tid, azithromycin 500mg od, x-ray chest, blood sugar test"
"night sweats, burning urination, fever","iron supplements od, levocetirizine 5mg od, ibuprofen 400mg bid, spirometry, kidney function test"
"shortness of breath, muscle pain","diclofenac 50mg bid, doxycycline 100mg bid, throat swab culture, stool test"
"night sweats, swelling, frequent urination","doxycycline 100mg bid, salbutamol inhaler prn, ondansetron 4mg tid, stool test, blood sugar test"
"body ache, diarrhea, loss of smell, fever","salbutamol inhaler prn, multivitamin daily, cbc blood test"
"abdominal pain, headache, chest pain","oral rehydration salts, salbutamol inhaler prn, ibuprofen 400mg bid, blood sugar test, dengue test"
"joint pain, skin rash, cough","cetirizine 10mg od, pantoprazole 40mg od, metronidazole 400mg tid, throat swab culture"
"sore throat, palpitations","metronidazole 400mg tid, salbutamol inhaler prn, serum electrolytes, ecg test"
"body ache, vomiting","hydrocortisone cream bid, metronidazole 400mg tid, serum electrolytes, spirometry"
"muscle pain, swelling, joint pain","paracetamol 500mg tid, ondansetron 4mg tid, amoxicillin 500mg tid, malaria parasite test, cbc blood test"
"loss of smell, body ache, vomiting, abdominal pain","salbutamol inhaler prn, azithromycin 500mg od, cbc blood test, ecg test"
"ear pain, fatigue, dizziness","salbutamol inhaler prn, multivitamin daily, throat swab culture, malaria parasite test"
"muscle pain, runny nose, eye redness","ondansetron 4mg tid, cetirizine 10mg od, malaria parasite test"
"sore throat, burning urination, cough","salbutamol inhaler prn, paracetamol 500mg tid, hydrocortisone cream bid, stool test, serum electrolytes"
"shortness of breath, swelling","iron supplements od, hydrocortisone cream bid, throat swab culture"
"weight loss, headache","diclofenac 50mg bid, metronidazole 400mg tid, azithromycin 500mg od, blood sugar test, spirometry"
"skin rash, headache, fever, difficulty breathing","cetirizine 10mg od, amoxicillin 500mg tid, loratadine 10mg od, dengue test"
"sore throat, burning urination, shortness of breath","diclofenac 50mg bid, iron supplements od, kidney function test"
"sore throat, sneezing, frequent urination","hydrocortisone cream bid, loratadine 10mg od, cetirizine 10mg od, cbc blood test, blood sugar test"
"dizziness, fever, loss of appetite, diarrhea","levocetirizine 5mg od, cetirizine 10mg od, amoxicillin 500mg tid, spirometry, stool test"
"ear pain, sore throat","levocetirizine 5mg od, diclofenac 50mg bid, kidney function test, malaria parasite test"
"shortness of breath, loss of smell, fatigue","amoxicillin 500mg tid, atorvastatin 10mg od, stool test"
"abdominal pain, loss of taste, fatigue, loss of appetite","levocetirizine 5mg od, amoxicillin 500mg tid, metronidazole 400mg tid, x-ray chest"
"runny nose, itching, loss of smell, loss of appetite","amoxicillin 500mg tid, doxycycline 100mg bid, cbc blood test, spirometry"
"productive cough, muscle pain, palpitations","ibuprofen 400mg bid, hydrocortisone cream bid, multivitamin daily, cbc blood test"
"difficulty breathing, loss of appetite, productive cough, eye redness","levocetirizine 5mg od, paracetamol 500mg tid, cbc blood test, serum electrolytes"
"palpitations, night sweats, swelling","ibuprofen 400mg bid, pantoprazole 40mg od, azithromycin 500mg od, urine analysis"
"fever, night sweats","amoxicillin 500mg tid, iron supplements od, spirometry, blood sugar test"
"loss of appetite, skin rash, night sweats, frequent urination","doxycycline 100mg bid, ibuprofen 400mg bid, spirometry, urine analysis"
"productive cough, cough","salbutamol inhaler prn, paracetamol 500mg tid, x-ray chest, serum electrolytes"
"sneezing, itching","multivitamin daily, metronidazole 400mg tid, atorvastatin 10mg od, throat swab culture, serum electrolytes"
"fever, night sweats, runny nose","multivitamin daily, paracetamol 500mg tid, iron supplements od, serum electrolytes, kidney function test"
"swelling, fatigue, palpitations, shortness of breath","ibuprofen 400mg bid, loratadine 10mg od, ecg test, stool test"
"body ache, eye redness","cetirizine 10mg od, iron supplements od, malaria parasite test, blood sugar test"
"productive cough, diarrhea, shortness of breath","ondansetron 4mg tid, atorvastatin 10mg od, throat swab culture"
"itching, palpitations","paracetamol 500mg tid, amoxicillin 500mg tid, pantoprazole 40mg od, blood sugar test, x-ray chest"
"chest pain, loss of smell, burning urination","cetirizine 10mg od, oral rehydration salts, throat swab culture, blood sugar test"
"vomiting, skin rash, back pain","azithromycin 500mg od, ibuprofen 400mg bid, urine analysis"
"swelling, vomiting, productive cough, joint pain","doxycycline 100mg bid, iron supplements od, stool test"
"eye redness, fever, sneezing","cetirizine 10mg od, salbutamol inhaler prn, stool test"
"itching, eye redness, sore throat, burning urination","ibuprofen 400mg bid, multivitamin daily, amoxicillin 500mg tid, serum electrolytes, throat swab culture"
"weight loss, skin rash, cough, fatigue","azithromycin 500mg od, hydrocortisone cream bid, urine analysis"
"loss of appetite, productive cough, sneezing, fatigue","multivitamin daily, diclofenac 50mg bid, amoxicillin 500mg tid, dengue test, blood sugar test"
"productive cough, sore throat","iron supplements od, doxycycline 100mg bid, hydrocortisone cream bid, stool test, ecg test"
"loss of taste, abdominal pain","cetirizine 10mg od, loratadine 10mg od, multivitamin daily, spirometry, dengue test"
"runny nose, joint pain, itching","multivitamin daily, doxycycline 100mg bid, liver function test"
"burning urination, swelling, muscle pain, abdominal pain","ondansetron 4mg tid, loratadine 10mg od, stool test"
"ear pain, weight loss, productive cough, frequent urination","loratadine 10mg od, pantoprazole 40mg od, ibuprofen 400mg bid, cbc blood test"
"frequent urination, ear pain, sore throat","metronidazole 400mg tid, doxycycline 100mg bid, diclofenac 50mg bid, liver function test"
"shortness of breath, weight loss, abdominal pain","iron supplements od, doxycycline 100mg bid, atorvastatin 10mg od, ecg test, serum electrolytes"
"headache, joint pain","diclofenac 50mg bid, amoxicillin 500mg tid, cbc blood test"
"weight loss, body ache","hydrocortisone cream bid, metronidazole 400mg tid, levocetirizine 5mg od, spirometry, cbc blood test"
"cough, difficulty breathing, body ache","amoxicillin 500mg tid, iron supplements od, multivitamin daily, liver function test, blood sugar test"
"headache, palpitations, burning urination","amoxicillin 500mg tid, ibuprofen 400mg bid, atorvastatin 10mg od, cbc blood test, spirometry"
"shortness of breath, weight loss, productive cough","salbutamol inhaler prn, doxycycline 100mg bid, iron supplements od, malaria parasite test"
"weight loss, body ache, difficulty breathing","metronidazole 400mg tid, ibuprofen 400mg bid, loratadine 10mg od, dengue test"
"palpitations, diarrhea, fatigue","atorvastatin 10mg od, multivitamin daily, metronidazole 400mg tid, urine analysis"
"chest pain, loss of taste, headache","amoxicillin 500mg tid, multivitamin daily, cbc blood test"
"palpitations, vomiting, diarrhea, loss of taste","iron supplements od, hydrocortisone cream bid, liver function test, dengue test"
"swelling, weight loss, chest pain, fever","amoxicillin 500mg tid, salbutamol inhaler prn, multivitamin daily, throat swab culture, x-ray chest"
"diarrhea, back pain","doxycycline 100mg bid, salbutamol inhaler prn, atorvastatin 10mg od, ecg test"
"weight loss, loss of appetite","paracetamol 500mg tid, azithromycin 500mg od, cetirizine 10mg od, kidney function test"
"diarrhea, loss of smell","cetirizine 10mg od, iron supplements od, blood sugar test"
"itching, palpitations, loss of smell, vomiting","salbutamol inhaler prn, metronidazole 400mg tid, hydrocortisone cream bid, urine analysis, kidney function test"
"eye redness, frequent urination, difficulty breathing, chest pain","azithromycin 500mg od, multivitamin daily, levocetirizine 5mg od, stool test"
"weight loss, eye redness","salbutamol inhaler prn, oral rehydration salts, levocetirizine 5mg od, blood sugar test, urine analysis"
"headache, shortness of breath","pantoprazole 40mg od, salbutamol inhaler prn, loratadine 10mg od, blood sugar test, spirometry"
"skin rash, shortness of breath","diclofenac 50mg bid, ondansetron 4mg tid, iron supplements od, serum electrolytes"
"productive cough, abdominal pain, shortness of breath","loratadine 10mg od, atorvastatin 10mg od, blood sugar test, liver function test"
"loss of appetite, sneezing","oral rehydration salts, iron supplements od, pantoprazole 40mg od, dengue test, malaria parasite test"
"back pain, ear pain","pantoprazole 40mg od, hydrocortisone cream bid, throat swab culture"
"palpitations, itching","loratadine 10mg od, paracetamol 500mg tid, ibuprofen 400mg bid, x-ray chest"
"productive cough, back pain, shortness of breath","oral rehydration salts, multivitamin daily, blood sugar test, spirometry"
"weight loss, sneezing, muscle pain, fatigue","ondansetron 4mg tid, azithromycin 500mg od, doxycycline 100mg bid, cbc blood test, blood sugar test"
"eye redness, joint pain, loss of smell","doxycycline 100mg bid, oral rehydration salts, iron supplements od, blood sugar test, dengue test"
"productive cough, itching","multivitamin daily, ondansetron 4mg tid, spirometry"
"eye redness, night sweats, body ache","azithromycin 500mg od, atorvastatin 10mg od, malaria parasite test"
"loss of smell, eye redness, fatigue, night sweats","metronidazole 400mg tid, amoxicillin 500mg tid, cetirizine 10mg od, stool test, dengue test"
"joint pain, itching, diarrhea","diclofenac 50mg bid, doxycycline 100mg bid, throat swab culture"
"sore throat, vomiting, skin rash","pantoprazole 40mg od, oral rehydration salts, iron supplements od, ecg test"
"cough, productive cough, headache, sore throat","ondansetron 4mg tid, pantoprazole 40mg od, paracetamol 500mg tid, malaria parasite test, cbc blood test"
"difficulty breathing, sore throat, eye redness, joint pain","pantoprazole 40mg od, paracetamol 500mg tid, hydrocortisone cream bid, spirometry"
"dizziness, eye redness, weight loss, shortness of breath","salbutamol inhaler prn, pantoprazole 40mg od, spirometry, serum electrolytes"
"loss of smell, muscle pain, chest pain, abdominal pain","ondansetron 4mg tid, diclofenac 50mg bid, liver function test"
"burning urination, fatigue","hydrocortisone cream bid, oral rehydration salts, ondansetron 4mg tid, malaria parasite test"
"dizziness, fever","oral rehydration salts, diclofenac 50mg bid, x-ray chest, blood sugar test"
"diarrhea, skin rash, burning urination","paracetamol 500mg tid, ondansetron 4mg tid, azithromycin 500mg od, x-ray chest"
"night sweats, burning urination, loss of taste","amoxicillin 500mg tid, ibuprofen 400mg bid, serum electrolytes, spirometry"
"difficulty breathing, frequent urination","atorvastatin 10mg od, iron supplements od, levocetirizine 5mg od, spirometry"
"itching, fever","atorvastatin 10mg od, oral rehydration salts, ondansetron 4mg tid, ecg test, liver function test"
"dizziness, frequent urination, sore throat, loss of smell","salbutamol inhaler prn, cetirizine 10mg od, liver function test, spirometry"
"eye redness, runny nose, shortness of breath, palpitations","amoxicillin 500mg tid, pantoprazole 40mg od, diclofenac 50mg bid, x-ray chest"
"loss of appetite, fatigue, diarrhea, dizziness","cetirizine 10mg od, pantoprazole 40mg od, stool test, throat swab culture"
"swelling, cough, chest pain, productive cough","pantoprazole 40mg od, atorvastatin 10mg od, multivitamin daily, dengue test, stool test"
"cough, vomiting, ear pain, night sweats","pantoprazole 40mg od, multivitamin daily, levocetirizine 5mg od, ecg test, blood sugar test"
"shortness of breath, difficulty breathing, muscle pain, joint pain","cetirizine 10mg od, ibuprofen 400mg bid, metronidazole 400mg tid, malaria parasite test, cbc blood test"
"shortness of breath, productive cough, difficulty breathing","paracetamol 500mg tid, metronidazole 400mg tid, pantoprazole 40mg od, stool test"
"fever, dizziness, burning urination, loss of taste","multivitamin daily, hydrocortisone cream bid, blood sugar test, throat swab culture"
"headache, ear pain, eye redness, muscle pain","loratadine 10mg od, pantoprazole 40mg od, serum electrolytes"
"loss of taste, burning urination, ear pain","paracetamol 500mg tid, metronidazole 400mg tid, azithromycin 500mg od, liver function test, urine analysis"
"runny nose, dizziness, abdominal pain, itching","salbutamol inhaler prn, hydrocortisone cream bid, oral rehydration salts, malaria parasite test"
"difficulty breathing, swelling, sore throat, joint pain","atorvastatin 10mg od, loratadine 10mg od, ecg test, malaria parasite test"
"muscle pain, loss of smell, abdominal pain, sore throat","iron supplements od, salbutamol inhaler prn, cetirizine 10mg od, blood sugar test, spirometry"
